smartctl 7.5 2025-04-30 r5714 [x86_64-linux-7.0.0-31-generic] (local build)
Copyright (C) 2002-25, Bruce Allen, Christian Franke, www.smartmontools.org

=== START OF INFORMATION SECTION ===
Model Family:     Western Digital Blue (SMR)
Device Model:     WDC WD40EZAZ-00SF3B0
Serial Number:    WD-WXA2A923AF21
LU WWN Device Id: 5 0014ee 2c02b4099
Firmware Version: 80.00A80
User Capacity:    4,000,787,030,016 bytes [4.00 TB]
Sector Sizes:     512 bytes logical, 4096 bytes physical
Rotation Rate:    5400 rpm
Form Factor:      3.5 inches
TRIM Command:     Available, deterministic, zeroed
Device is:        In smartctl database 7.5/5706
ATA Version is:   ACS-3 T13/2161-D revision 5
SATA Version is:  SATA 3.1, 6.0 Gb/s (current: 6.0 Gb/s)
Local Time is:    Wed Sep 23 02:29:41 2026 CDT
SMART support is: Available - device has SMART capability.
SMART support is: Enabled
AAM feature is:   Unavailable
APM feature is:   Unavailable
Rd look-ahead is: Enabled
Write cache is:   Enabled
DSN feature is:   Unavailable
ATA Security is:  Disabled, frozen [SEC2]

=== START OF READ SMART DATA SECTION ===
SMART overall-health self-assessment test result: PASSED

General SMART Values:
Offline data collection status:  (0x00)	Offline data collection activity
					was never started.
					Auto Offline Data Collection: Disabled.
Self-test execution status:      (   0)	The previous self-test routine completed
					without error or no self-test has ever 
					been run.
Total time to complete Offline 
data collection: 		(24660) seconds.
Offline data collection
capabilities: 			 (0x7b) SMART execute Offline immediate.
					Auto Offline data collection on/off support.
					Suspend Offline collection upon new
					command.
					Offline surface scan supported.
					Self-test supported.
					Conveyance Self-test supported.
					Selective Self-test supported.
SMART capabilities:            (0x0003)	Saves SMART data before entering
					power-saving mode.
					Supports SMART auto save timer.
Error logging capability:        (0x01)	Error logging supported.
					General Purpose Logging supported.
Short self-test routine 
recommended polling time: 	 (   2) minutes.
Extended self-test routine
recommended polling time: 	 (  98) minutes.
Conveyance self-test routine
recommended polling time: 	 (   2) minutes.
SCT capabilities: 	       (0x3031)	SCT Status supported.
					SCT Feature Control supported.
					SCT Data Table supported.

SMART Attributes Data Structure revision number: 16
Vendor Specific SMART Attributes with Thresholds:
ID# ATTRIBUTE_NAME          FLAGS    VALUE WORST THRESH FAIL RAW_VALUE
  1 Raw_Read_Error_Rate     POSR-K   200   200   051    -    0
  3 Spin_Up_Time            POS--K   208   207   021    -    2591
  4 Start_Stop_Count        -O--CK   099   099   000    -    1247
  5 Reallocated_Sector_Ct   PO--CK   200   200   140    -    0
  7 Seek_Error_Rate         -OSR-K   100   253   000    -    0
  9 Power_On_Hours          -O--CK   061   061   000    -    28936
 10 Spin_Retry_Count        -O--CK   100   100   000    -    0
 11 Calibration_Retry_Count -O--CK   100   253   000    -    0
 12 Power_Cycle_Count       -O--CK   100   100   000    -    51
192 Power-Off_Retract_Count -O--CK   200   200   000    -    17
193 Load_Cycle_Count        -O--CK   197   197   000    -    9493
194 Temperature_Celsius     -O---K   109   100   000    -    38
196 Reallocated_Event_Count -O--CK   200   200   000    -    0
197 Current_Pending_Sector  -O--CK   200   200   000    -    0
198 Offline_Uncorrectable   ----CK   100   253   000    -    0
199 UDMA_CRC_Error_Count    -O--CK   200   200   000    -    0
200 Multi_Zone_Error_Rate   ---R--   100   253   000    -    0
                            ||||||_ K auto-keep
                            |||||__ C event count
                            ||||___ R error rate
                            |||____ S speed/performance
                            ||_____ O updated online
                            |______ P prefailure warning

General Purpose Log Directory Version 1
SMART           Log Directory Version 1 [multi-sector log support]
Address    Access  R/W   Size  Description
0x00       GPL,SL  R/O      1  Log Directory
0x01           SL  R/O      1  Summary SMART error log
0x02           SL  R/O      5  Comprehensive SMART error log
0x03       GPL     R/O      6  Ext. Comprehensive SMART error log
0x04       GPL     R/O    256  Device Statistics log
0x04       SL      R/O      8  Device Statistics log
0x06           SL  R/O      1  SMART self-test log
0x07       GPL     R/O      1  Extended self-test log
0x09           SL  R/W      1  Selective self-test log
0x0c       GPL     R/O   2048  Pending Defects log
0x10       GPL     R/O      1  NCQ Command Error log
0x11       GPL     R/O      1  SATA Phy Event Counters log
0x24       GPL     R/O    294  Current Device Internal Status Data log
0x30       GPL,SL  R/O      9  IDENTIFY DEVICE data log
0x80-0x9f  GPL,SL  R/W     16  Host vendor specific log
0xa0-0xa7  GPL,SL  VS      16  Device vendor specific log
0xa8-0xb6  GPL,SL  VS       1  Device vendor specific log
0xb7       GPL,SL  VS      78  Device vendor specific log
0xb9       GPL,SL  VS       4  Device vendor specific log
0xbd       GPL,SL  VS       1  Device vendor specific log
0xc0       GPL,SL  VS       1  Device vendor specific log
0xc1       GPL     VS      93  Device vendor specific log
0xe0       GPL,SL  R/W      1  SCT Command/Status
0xe1       GPL,SL  R/W      1  SCT Data Transfer

SMART Extended Comprehensive Error Log Version: 1 (6 sectors)
No Errors Logged

SMART Extended Self-test Log Version: 1 (1 sectors)
No self-tests have been logged.  [To run self-tests, use: smartctl -t]

SMART Selective self-test log data structure revision number 1
 SPAN  MIN_LBA  MAX_LBA  CURRENT_TEST_STATUS
    1        0        0  Not_testing
    2        0        0  Not_testing
    3        0        0  Not_testing
    4        0        0  Not_testing
    5        0        0  Not_testing
Selective self-test flags (0x0):
  After scanning selected spans, do NOT read-scan remainder of disk.
If Selective self-test is pending on power-up, resume after 0 minute delay.

SCT Status Version:                  3
SCT Version (vendor specific):       258 (0x0102)
Device State:                        Active (0)
Current Temperature:                    38 Celsius
Power Cycle Min/Max Temperature:     22/46 Celsius
Lifetime    Min/Max Temperature:     17/47 Celsius
Under/Over Temperature Limit Count:   0/0
Vendor specific:
01 00 00 00 00 00 00 00 00 00 00 00 00 00 00 00
00 00 00 00 00 00 00 00 00 00 00 00 00 00 00 00

SCT Temperature History Version:     2
Temperature Sampling Period:         1 minute
Temperature Logging Interval:        1 minute
Min/Max recommended Temperature:      0/60 Celsius
Min/Max Temperature Limit:           -41/85 Celsius
Temperature History Size (Index):    478 (282)

Index    Estimated Time   Temperature Celsius
 283    2026-09-22 18:32    39  ********************
 ...    ..(164 skipped).    ..  ********************
 448    2026-09-22 21:17    39  ********************
 449    2026-09-22 21:18    38  *******************
 450    2026-09-22 21:19    38  *******************
 451    2026-09-22 21:20    39  ********************
 452    2026-09-22 21:21    38  *******************
 453    2026-09-22 21:22    38  *******************
 454    2026-09-22 21:23    39  ********************
 455    2026-09-22 21:24    39  ********************
 456    2026-09-22 21:25    38  *******************
 457    2026-09-22 21:26    38  *******************
 458    2026-09-22 21:27    39  ********************
 459    2026-09-22 21:28    38  *******************
 ...    ..(  4 skipped).    ..  *******************
 464    2026-09-22 21:33    38  *******************
 465    2026-09-22 21:34    39  ********************
 466    2026-09-22 21:35    38  *******************
 467    2026-09-22 21:36    38  *******************
 468    2026-09-22 21:37    38  *******************
 469    2026-09-22 21:38    39  ********************
 470    2026-09-22 21:39    38  *******************
 ...    ..(  7 skipped).    ..  *******************
   0    2026-09-22 21:47    38  *******************
   1    2026-09-22 21:48    39  ********************
 ...    ..( 16 skipped).    ..  ********************
  18    2026-09-22 22:05    39  ********************
  19    2026-09-22 22:06    38  *******************
 ...    ..( 43 skipped).    ..  *******************
  63    2026-09-22 22:50    38  *******************
  64    2026-09-22 22:51    39  ********************
 ...    ..( 19 skipped).    ..  ********************
  84    2026-09-22 23:11    39  ********************
  85    2026-09-22 23:12    38  *******************
 ...    ..( 39 skipped).    ..  *******************
 125    2026-09-22 23:52    38  *******************
 126    2026-09-22 23:53    39  ********************
 127    2026-09-22 23:54    38  *******************
 128    2026-09-22 23:55    38  *******************
 129    2026-09-22 23:56    39  ********************
 ...    ..(  5 skipped).    ..  ********************
 135    2026-09-23 00:02    39  ********************
 136    2026-09-23 00:03    38  *******************
 137    2026-09-23 00:04    39  ********************
 138    2026-09-23 00:05    39  ********************
 139    2026-09-23 00:06    38  *******************
 ...    ..(  9 skipped).    ..  *******************
 149    2026-09-23 00:16    38  *******************
 150    2026-09-23 00:17    39  ********************
 ...    ..( 44 skipped).    ..  ********************
 195    2026-09-23 01:02    39  ********************
 196    2026-09-23 01:03    38  *******************
 197    2026-09-23 01:04    39  ********************
 ...    ..(  2 skipped).    ..  ********************
 200    2026-09-23 01:07    39  ********************
 201    2026-09-23 01:08    38  *******************
 202    2026-09-23 01:09    38  *******************
 203    2026-09-23 01:10    38  *******************
 204    2026-09-23 01:11    39  ********************
 205    2026-09-23 01:12    39  ********************
 206    2026-09-23 01:13    38  *******************
 207    2026-09-23 01:14    39  ********************
 208    2026-09-23 01:15    39  ********************
 209    2026-09-23 01:16    38  *******************
 ...    ..(  5 skipped).    ..  *******************
 215    2026-09-23 01:22    38  *******************
 216    2026-09-23 01:23    39  ********************
 217    2026-09-23 01:24    38  *******************
 218    2026-09-23 01:25    38  *******************
 219    2026-09-23 01:26    38  *******************
 220    2026-09-23 01:27    39  ********************
 221    2026-09-23 01:28    38  *******************
 222    2026-09-23 01:29    39  ********************
 ...    ..( 33 skipped).    ..  ********************
 256    2026-09-23 02:03    39  ********************
 257    2026-09-23 02:04    38  *******************
 ...    ..(  3 skipped).    ..  *******************
 261    2026-09-23 02:08    38  *******************
 262    2026-09-23 02:09    39  ********************
 263    2026-09-23 02:10    38  *******************
 264    2026-09-23 02:11    39  ********************
 265    2026-09-23 02:12    38  *******************
 266    2026-09-23 02:13    38  *******************
 267    2026-09-23 02:14    38  *******************
 268    2026-09-23 02:15    39  ********************
 269    2026-09-23 02:16    38  *******************
 270    2026-09-23 02:17    39  ********************
 271    2026-09-23 02:18    39  ********************
 272    2026-09-23 02:19    38  *******************
 ...    ..(  2 skipped).    ..  *******************
 275    2026-09-23 02:22    38  *******************
 276    2026-09-23 02:23    39  ********************
 277    2026-09-23 02:24    38  *******************
 278    2026-09-23 02:25    39  ********************
 279    2026-09-23 02:26    39  ********************
 280    2026-09-23 02:27    38  *******************
 281    2026-09-23 02:28    39  ********************
 282    2026-09-23 02:29    39  ********************

SCT Error Recovery Control command not supported

Device Statistics (GP Log 0x04)
Page  Offset Size        Value Flags Description
0x01  =====  =               =  ===  == General Statistics (rev 1) ==
0x01  0x008  4              51  ---  Lifetime Power-On Resets
0x01  0x010  4           28936  ---  Power-on Hours
0x01  0x018  6     20371768565  ---  Logical Sectors Written
0x01  0x020  6        38744689  ---  Number of Write Commands
0x01  0x028  6     72044572309  ---  Logical Sectors Read
0x01  0x030  6        68667922  ---  Number of Read Commands
0x01  0x038  6      1090384896  ---  Date and Time TimeStamp
0x03  =====  =               =  ===  == Rotating Media Statistics (rev 1) ==
0x03  0x008  4           28009  ---  Spindle Motor Power-on Hours
0x03  0x010  4            1801  ---  Head Flying Hours
0x03  0x018  4            9511  ---  Head Load Events
0x03  0x020  4               0  ---  Number of Reallocated Logical Sectors
0x03  0x028  4               0  ---  Read Recovery Attempts
0x03  0x030  4               0  ---  Number of Mechanical Start Failures
0x03  0x038  4               0  ---  Number of Realloc. Candidate Logical Sectors
0x03  0x040  4              17  ---  Number of High Priority Unload Events
0x04  =====  =               =  ===  == General Errors Statistics (rev 1) ==
0x04  0x008  4               0  ---  Number of Reported Uncorrectable Errors
0x04  0x010  4               0  ---  Resets Between Cmd Acceptance and Completion
0x05  =====  =               =  ===  == Temperature Statistics (rev 1) ==
0x05  0x008  1              38  ---  Current Temperature
0x05  0x010  1              38  ---  Average Short Term Temperature
0x05  0x018  1              38  ---  Average Long Term Temperature
0x05  0x020  1              46  ---  Highest Temperature
0x05  0x028  1              21  ---  Lowest Temperature
0x05  0x030  1              45  ---  Highest Average Short Term Temperature
0x05  0x038  1              31  ---  Lowest Average Short Term Temperature
0x05  0x040  1              40  ---  Highest Average Long Term Temperature
0x05  0x048  1              34  ---  Lowest Average Long Term Temperature
0x05  0x050  4               0  ---  Time in Over-Temperature
0x05  0x058  1              60  ---  Specified Maximum Operating Temperature
0x05  0x060  4               0  ---  Time in Under-Temperature
0x05  0x068  1               0  ---  Specified Minimum Operating Temperature
0x06  =====  =               =  ===  == Transport Statistics (rev 1) ==
0x06  0x008  4            2313  ---  Number of Hardware Resets
0x06  0x010  4            2227  ---  Number of ASR Events
0x06  0x018  4               0  ---  Number of Interface CRC Errors
0xff  =====  =               =  ===  == Vendor Specific Statistics (rev 1) ==
0xff  0x008  7               0  ---  Vendor Specific
0xff  0x010  7               0  ---  Vendor Specific
0xff  0x018  7               0  ---  Vendor Specific
                                |||_ C monitored condition met
                                ||__ D supports DSN
                                |___ N normalized value

Pending Defects log (GP Log 0x0c)
No Defects Logged

SATA Phy Event Counters (GP Log 0x11)
ID      Size     Value  Description
0x0001  2            0  Command failed due to ICRC error
0x0002  2            0  R_ERR response for data FIS
0x0003  2            0  R_ERR response for device-to-host data FIS
0x0004  2            0  R_ERR response for host-to-device data FIS
0x0005  2            0  R_ERR response for non-data FIS
0x0006  2            0  R_ERR response for device-to-host non-data FIS
0x0007  2            0  R_ERR response for host-to-device non-data FIS
0x0008  2            0  Device-to-host non-data FIS retries
0x0009  2           12  Transition from drive PhyRdy to drive PhyNRdy
0x000a  2           17  Device-to-host register FISes sent due to a COMRESET
0x000b  2            0  CRC errors within host-to-device FIS
0x000d  2            0  Non-CRC errors within host-to-device FIS
0x000f  2            0  R_ERR response for host-to-device data FIS, CRC
0x0012  2            0  R_ERR response for host-to-device non-data FIS, CRC
0x8000  4      3266400  Vendor specific

