smartctl 7.5 2025-04-30 r5714 [x86_64-linux-7.0.0-31-generic] (local build)
Copyright (C) 2002-25, Bruce Allen, Christian Franke, www.smartmontools.org

=== START OF INFORMATION SECTION ===
Model Family:     Western Digital Blue (SMR)
Device Model:     WDC WD40EZAZ-00SF3B0
Serial Number:    WD-WXA2A923AF21
LU WWN Device Id: 5 0014ee 2c02b4099
Firmware Version: 80.00A80
User Capacity:    4,000,787,030,016 bytes [4.00 TB]
Sector Sizes:     512 bytes logical, 4096 bytes physical
Rotation Rate:    5400 rpm
Form Factor:      3.5 inches
TRIM Command:     Available, deterministic, zeroed
Device is:        In smartctl database 7.5/5706
ATA Version is:   ACS-3 T13/2161-D revision 5
SATA Version is:  SATA 3.1, 6.0 Gb/s (current: 6.0 Gb/s)
Local Time is:    Wed Sep 23 07:53:18 2026 CDT
SMART support is: Available - device has SMART capability.
SMART support is: Enabled
AAM feature is:   Unavailable
APM feature is:   Unavailable
Rd look-ahead is: Enabled
Write cache is:   Enabled
DSN feature is:   Unavailable
ATA Security is:  Disabled, frozen [SEC2]

=== START OF READ SMART DATA SECTION ===
SMART overall-health self-assessment test result: PASSED

General SMART Values:
Offline data collection status:  (0x00)	Offline data collection activity
					was never started.
					Auto Offline Data Collection: Disabled.
Self-test execution status:      (   0)	The previous self-test routine completed
					without error or no self-test has ever 
					been run.
Total time to complete Offline 
data collection: 		(24660) seconds.
Offline data collection
capabilities: 			 (0x7b) SMART execute Offline immediate.
					Auto Offline data collection on/off support.
					Suspend Offline collection upon new
					command.
					Offline surface scan supported.
					Self-test supported.
					Conveyance Self-test supported.
					Selective Self-test supported.
SMART capabilities:            (0x0003)	Saves SMART data before entering
					power-saving mode.
					Supports SMART auto save timer.
Error logging capability:        (0x01)	Error logging supported.
					General Purpose Logging supported.
Short self-test routine 
recommended polling time: 	 (   2) minutes.
Extended self-test routine
recommended polling time: 	 (  98) minutes.
Conveyance self-test routine
recommended polling time: 	 (   3) minutes.
SCT capabilities: 	       (0x3031)	SCT Status supported.
					SCT Feature Control supported.
					SCT Data Table supported.

SMART Attributes Data Structure revision number: 16
Vendor Specific SMART Attributes with Thresholds:
ID# ATTRIBUTE_NAME          FLAGS    VALUE WORST THRESH FAIL RAW_VALUE
  1 Raw_Read_Error_Rate     POSR-K   200   200   051    -    0
  3 Spin_Up_Time            POS--K   208   207   021    -    2591
  4 Start_Stop_Count        -O--CK   099   099   000    -    1247
  5 Reallocated_Sector_Ct   PO--CK   200   200   140    -    0
  7 Seek_Error_Rate         -OSR-K   200   200   000    -    0
  9 Power_On_Hours          -O--CK   061   061   000    -    28941
 10 Spin_Retry_Count        -O--CK   100   100   000    -    0
 11 Calibration_Retry_Count -O--CK   100   253   000    -    0
 12 Power_Cycle_Count       -O--CK   100   100   000    -    51
192 Power-Off_Retract_Count -O--CK   200   200   000    -    17
193 Load_Cycle_Count        -O--CK   197   197   000    -    9494
194 Temperature_Celsius     -O---K   108   100   000    -    39
196 Reallocated_Event_Count -O--CK   200   200   000    -    0
197 Current_Pending_Sector  -O--CK   200   200   000    -    0
198 Offline_Uncorrectable   ----CK   100   253   000    -    0
199 UDMA_CRC_Error_Count    -O--CK   200   200   000    -    0
200 Multi_Zone_Error_Rate   ---R--   200   200   000    -    0
                            ||||||_ K auto-keep
                            |||||__ C event count
                            ||||___ R error rate
                            |||____ S speed/performance
                            ||_____ O updated online
                            |______ P prefailure warning

General Purpose Log Directory Version 1
SMART           Log Directory Version 1 [multi-sector log support]
Address    Access  R/W   Size  Description
0x00       GPL,SL  R/O      1  Log Directory
0x01           SL  R/O      1  Summary SMART error log
0x02           SL  R/O      5  Comprehensive SMART error log
0x03       GPL     R/O      6  Ext. Comprehensive SMART error log
0x04       GPL     R/O    256  Device Statistics log
0x04       SL      R/O      8  Device Statistics log
0x06           SL  R/O      1  SMART self-test log
0x07       GPL     R/O      1  Extended self-test log
0x09           SL  R/W      1  Selective self-test log
0x0c       GPL     R/O   2048  Pending Defects log
0x10       GPL     R/O      1  NCQ Command Error log
0x11       GPL     R/O      1  SATA Phy Event Counters log
0x24       GPL     R/O    294  Current Device Internal Status Data log
0x30       GPL,SL  R/O      9  IDENTIFY DEVICE data log
0x80-0x9f  GPL,SL  R/W     16  Host vendor specific log
0xa0-0xa7  GPL,SL  VS      16  Device vendor specific log
0xa8-0xb6  GPL,SL  VS       1  Device vendor specific log
0xb7       GPL,SL  VS      78  Device vendor specific log
0xb9       GPL,SL  VS       4  Device vendor specific log
0xbd       GPL,SL  VS       1  Device vendor specific log
0xc0       GPL,SL  VS       1  Device vendor specific log
0xc1       GPL     VS      93  Device vendor specific log
0xe0       GPL,SL  R/W      1  SCT Command/Status
0xe1       GPL,SL  R/W      1  SCT Data Transfer

SMART Extended Comprehensive Error Log Version: 1 (6 sectors)
No Errors Logged

SMART Extended Self-test Log Version: 1 (1 sectors)
Num  Test_Description    Status                  Remaining  LifeTime(hours)  LBA_of_first_error
# 1  Extended offline    Completed without error       00%     28938         -
# 2  Short offline       Completed without error       00%     28936         -

SMART Selective self-test log data structure revision number 1
 SPAN  MIN_LBA  MAX_LBA  CURRENT_TEST_STATUS
    1        0        0  Not_testing
    2        0        0  Not_testing
    3        0        0  Not_testing
    4        0        0  Not_testing
    5        0        0  Not_testing
Selective self-test flags (0x0):
  After scanning selected spans, do NOT read-scan remainder of disk.
If Selective self-test is pending on power-up, resume after 0 minute delay.

SCT Status Version:                  3
SCT Version (vendor specific):       258 (0x0102)
Device State:                        Active (0)
Current Temperature:                    39 Celsius
Power Cycle Min/Max Temperature:     22/46 Celsius
Lifetime    Min/Max Temperature:     17/47 Celsius
Under/Over Temperature Limit Count:   0/0
Vendor specific:
01 00 00 00 00 00 00 00 00 00 00 00 00 00 00 00
00 00 00 00 00 00 00 00 00 00 00 00 00 00 00 00

SCT Temperature History Version:     2
Temperature Sampling Period:         1 minute
Temperature Logging Interval:        1 minute
Min/Max recommended Temperature:      0/60 Celsius
Min/Max Temperature Limit:           -41/85 Celsius
Temperature History Size (Index):    478 (127)

Index    Estimated Time   Temperature Celsius
 128    2026-09-22 23:56    38  *******************
 129    2026-09-22 23:57    39  ********************
 ...    ..(  5 skipped).    ..  ********************
 135    2026-09-23 00:03    39  ********************
 136    2026-09-23 00:04    38  *******************
 137    2026-09-23 00:05    39  ********************
 138    2026-09-23 00:06    39  ********************
 139    2026-09-23 00:07    38  *******************
 ...    ..( 16 skipped).    ..  *******************
 156    2026-09-23 00:24    38  *******************
 157    2026-09-23 00:25    39  ********************
 158    2026-09-23 00:26    39  ********************
 159    2026-09-23 00:27    39  ********************
 160    2026-09-23 00:28    40  *********************
 ...    ..(  5 skipped).    ..  *********************
 166    2026-09-23 00:34    40  *********************
 167    2026-09-23 00:35    41  **********************
 ...    ..(  9 skipped).    ..  **********************
 177    2026-09-23 00:45    41  **********************
 178    2026-09-23 00:46    42  ***********************
 ...    ..( 16 skipped).    ..  ***********************
 195    2026-09-23 01:03    42  ***********************
 196    2026-09-23 01:04    43  ************************
 ...    ..( 20 skipped).    ..  ************************
 217    2026-09-23 01:25    43  ************************
 218    2026-09-23 01:26    42  ***********************
 ...    ..( 26 skipped).    ..  ***********************
 245    2026-09-23 01:53    42  ***********************
 246    2026-09-23 01:54    43  ************************
 ...    ..(  5 skipped).    ..  ************************
 252    2026-09-23 02:00    43  ************************
 253    2026-09-23 02:01    44  *************************
 ...    ..(  4 skipped).    ..  *************************
 258    2026-09-23 02:06    44  *************************
 259    2026-09-23 02:07    43  ************************
 260    2026-09-23 02:08    44  *************************
 261    2026-09-23 02:09    43  ************************
 ...    ..(  4 skipped).    ..  ************************
 266    2026-09-23 02:14    43  ************************
 267    2026-09-23 02:15    42  ***********************
 ...    ..(  3 skipped).    ..  ***********************
 271    2026-09-23 02:19    42  ***********************
 272    2026-09-23 02:20    41  **********************
 ...    ..(  4 skipped).    ..  **********************
 277    2026-09-23 02:25    41  **********************
 278    2026-09-23 02:26    40  *********************
 ...    ..(  8 skipped).    ..  *********************
 287    2026-09-23 02:35    40  *********************
 288    2026-09-23 02:36    39  ********************
 ...    ..( 51 skipped).    ..  ********************
 340    2026-09-23 03:28    39  ********************
 341    2026-09-23 03:29    38  *******************
 ...    ..( 40 skipped).    ..  *******************
 382    2026-09-23 04:10    38  *******************
 383    2026-09-23 04:11    39  ********************
 ...    ..( 21 skipped).    ..  ********************
 405    2026-09-23 04:33    39  ********************
 406    2026-09-23 04:34    38  *******************
 407    2026-09-23 04:35    39  ********************
 408    2026-09-23 04:36    38  *******************
 ...    ..( 23 skipped).    ..  *******************
 432    2026-09-23 05:00    38  *******************
 433    2026-09-23 05:01    39  ********************
 434    2026-09-23 05:02    38  *******************
 ...    ..(  2 skipped).    ..  *******************
 437    2026-09-23 05:05    38  *******************
 438    2026-09-23 05:06    39  ********************
 439    2026-09-23 05:07    38  *******************
 440    2026-09-23 05:08    39  ********************
 441    2026-09-23 05:09    38  *******************
 442    2026-09-23 05:10    38  *******************
 443    2026-09-23 05:11    39  ********************
 ...    ..( 27 skipped).    ..  ********************
 471    2026-09-23 05:39    39  ********************
 472    2026-09-23 05:40    38  *******************
 ...    ..(  5 skipped).    ..  *******************
   0    2026-09-23 05:46    38  *******************
   1    2026-09-23 05:47    39  ********************
 ...    ..( 16 skipped).    ..  ********************
  18    2026-09-23 06:04    39  ********************
  19    2026-09-23 06:05    38  *******************
 ...    ..( 43 skipped).    ..  *******************
  63    2026-09-23 06:49    38  *******************
  64    2026-09-23 06:50    39  ********************
 ...    ..( 19 skipped).    ..  ********************
  84    2026-09-23 07:10    39  ********************
  85    2026-09-23 07:11    38  *******************
 ...    ..( 39 skipped).    ..  *******************
 125    2026-09-23 07:51    38  *******************
 126    2026-09-23 07:52    39  ********************
 127    2026-09-23 07:53    38  *******************

SCT Error Recovery Control command not supported

Device Statistics (GP Log 0x04)
Page  Offset Size        Value Flags Description
0x01  =====  =               =  ===  == General Statistics (rev 1) ==
0x01  0x008  4              51  ---  Lifetime Power-On Resets
0x01  0x010  4           28941  ---  Power-on Hours
0x01  0x018  6     20371768567  ---  Logical Sectors Written
0x01  0x020  6        38744689  ---  Number of Write Commands
0x01  0x028  6     72044572515  ---  Logical Sectors Read
0x01  0x030  6        68667922  ---  Number of Read Commands
0x01  0x038  6      1108384896  ---  Date and Time TimeStamp
0x03  =====  =               =  ===  == Rotating Media Statistics (rev 1) ==
0x03  0x008  4           28015  ---  Spindle Motor Power-on Hours
0x03  0x010  4            1803  ---  Head Flying Hours
0x03  0x018  4            9512  ---  Head Load Events
0x03  0x020  4               0  ---  Number of Reallocated Logical Sectors
0x03  0x028  4               0  ---  Read Recovery Attempts
0x03  0x030  4               0  ---  Number of Mechanical Start Failures
0x03  0x038  4               0  ---  Number of Realloc. Candidate Logical Sectors
0x03  0x040  4              17  ---  Number of High Priority Unload Events
0x04  =====  =               =  ===  == General Errors Statistics (rev 1) ==
0x04  0x008  4               0  ---  Number of Reported Uncorrectable Errors
0x04  0x010  4               0  ---  Resets Between Cmd Acceptance and Completion
0x05  =====  =               =  ===  == Temperature Statistics (rev 1) ==
0x05  0x008  1              39  ---  Current Temperature
0x05  0x010  1              38  ---  Average Short Term Temperature
0x05  0x018  1              38  ---  Average Long Term Temperature
0x05  0x020  1              46  ---  Highest Temperature
0x05  0x028  1              21  ---  Lowest Temperature
0x05  0x030  1              45  ---  Highest Average Short Term Temperature
0x05  0x038  1              31  ---  Lowest Average Short Term Temperature
0x05  0x040  1              40  ---  Highest Average Long Term Temperature
0x05  0x048  1              34  ---  Lowest Average Long Term Temperature
0x05  0x050  4               0  ---  Time in Over-Temperature
0x05  0x058  1              60  ---  Specified Maximum Operating Temperature
0x05  0x060  4               0  ---  Time in Under-Temperature
0x05  0x068  1               0  ---  Specified Minimum Operating Temperature
0x06  =====  =               =  ===  == Transport Statistics (rev 1) ==
0x06  0x008  4            2313  ---  Number of Hardware Resets
0x06  0x010  4            2227  ---  Number of ASR Events
0x06  0x018  4               0  ---  Number of Interface CRC Errors
0xff  =====  =               =  ===  == Vendor Specific Statistics (rev 1) ==
0xff  0x008  7               0  ---  Vendor Specific
0xff  0x010  7               0  ---  Vendor Specific
0xff  0x018  7               0  ---  Vendor Specific
                                |||_ C monitored condition met
                                ||__ D supports DSN
                                |___ N normalized value

Pending Defects log (GP Log 0x0c)
No Defects Logged

SATA Phy Event Counters (GP Log 0x11)
ID      Size     Value  Description
0x0001  2            0  Command failed due to ICRC error
0x0002  2            0  R_ERR response for data FIS
0x0003  2            0  R_ERR response for device-to-host data FIS
0x0004  2            0  R_ERR response for host-to-device data FIS
0x0005  2            0  R_ERR response for non-data FIS
0x0006  2            0  R_ERR response for device-to-host non-data FIS
0x0007  2            0  R_ERR response for host-to-device non-data FIS
0x0008  2            0  Device-to-host non-data FIS retries
0x0009  2           12  Transition from drive PhyRdy to drive PhyNRdy
0x000a  2           17  Device-to-host register FISes sent due to a COMRESET
0x000b  2            0  CRC errors within host-to-device FIS
0x000d  2            0  Non-CRC errors within host-to-device FIS
0x000f  2            0  R_ERR response for host-to-device data FIS, CRC
0x0012  2            0  R_ERR response for host-to-device non-data FIS, CRC
0x8000  4      3285797  Vendor specific

